{"schema_version":"pysolate.object-ref.v1","source_sha256":"sha256:3988ea147d1730987668f1df3567fd9ca4dfe657f591e3644077bb4745755069","generated_at_policy":"omitted","ref":{"kind":"result","sha256":"sha256:7c8ee989b87bc916e54dc67cfd3868fd789bcab94aa2c7ef22e0ee19d5728760","privacy":"portable","availability":"available"}}