{"schema_version":"pysolate.object-ref.v1","source_sha256":"sha256:c66194cbfcb5bfc6183e88f4d2cdb976265ea99cabcea0a8d9b8f7146e85fec6","generated_at_policy":"omitted","ref":{"kind":"result","sha256":"sha256:7b2cbb4679505f86c3aba76647002facc0b6dde66ec30cb88ae78ef4b23a7c43","privacy":"portable","availability":"available"}}