{"schema_version":"pysolate.object-ref.v1","source_sha256":"sha256:3222d98ecec889b156cb3d3919390363150eef947cc361ff5b4d62be7fefc338","generated_at_policy":"omitted","ref":{"kind":"result","sha256":"sha256:e7379e8aa0baa53cd824dc052eb661518ac98a7c9b7ebae84da3808924fa7325","privacy":"portable","availability":"available"}}